{
  "schema_version": "repository-search-scope/v1",
  "scope_id": "kikatech-test-environment",
  "provider": "github",
  "repositories": [
    {
      "repository": "KikaTech/backend-aicompanion",
      "enabled": true,
      "default_branch": "master",
      "labels": [
        "ai陪伴",
        "后端"
      ]
    },
    {
      "repository": "KikaTech/frontend-aicompanion",
      "enabled": true,
      "default_branch": "master",
      "labels": [
        "ai陪伴",
        "前端"
      ]
    },
    {
      "repository": "KikaTech/kika-global-studio",
      "enabled": true,
      "default_branch": "master",
      "labels": [
        "studio",
        "后端"
      ]
    },
    {
      "repository": "KikaTech/kika-global-studio-front",
      "enabled": true,
      "default_branch": "main",
      "labels": [
        "studio",
        "前端"
      ]
    }
  ],
  "limits": {
    "max_queries": 8,
    "max_candidate_repositories": 1,
    "max_hits_per_query": 10
  }
}
